본문,결과
"같은 직장 다니는 3살 어린 여직원인데, 작년부터 슬슬 좋아지다가 올해부터 본격적으로 짝사랑 시작했는데요. 저희 팀원 분들 나이가 대부분 많으신 편이라 그나마 또래가 서로 밖에 없고, 동물도 좋아해서 짤 주고 받다보니 자연스럽게 친해진 사이에요. 요즘에는 주말에도 연락하고 지낼 정도로 많이 친해졌어요. 취미가 비슷해서 모바일 게임도 종종 같이하고... 기프티콘 같은 것도 몇 번 주고 받고...(이건 별 거 아니지만..) 한 반년 정도 요렇게 지냈어요. 재택 근무 때문에 회사에서는 한 달에 한 두번 볼까 말까..? 그래도 직접 보는 날은 서로 장난도 치고 얼굴 보면서 얘기할 수 있어서 너무 좋드라구요. 그렇게 좋던 재택 근무가 요새는 슬슬 싫어집디다. 근데 너무 서로 편해져서 그런지 뭔지, 여자 분이 요새 읽씹도 가끔 하고... 단답하는 게 서운해서 한 5일 정도 연락을 끊었었어요. 얘는 나한테 관심이 없나 보다 싶어서요. 서로 출근하는 날에 회사 근처에 사는 고양이 근황 알려주는 게 대화 주제 중에 하나이기도 한데... 며칠 전에 여자 분이 '요즘 고양이 안보인다'고 하던 게 생각나서 괭이 사진 찍어 보내면서 오랜만에 연락해 봤어요. 근데 이 분이 고양이 얘기는 안하고 갑자기 '요즘 뜸하십니다...'라고 하길래 저는 고양이 요즘 잘 안 보인다고 하는 건가 싶어서 물었더니 'xx 대리님(쓰니)이 뜸하시다고여!' 라고 하드라구요 ㅋㅋㅋ 자기가 뭐 잘못한 줄 알았다고... 무슨 일 있나 싶었다고... 서운한 이모티콘 보내면서... 아니 그러면 자기가 먼저 연락하면 되지...;; 얘가 내 연락을 기다렸구나 싶어서 내심 기쁘기도 하면서, 한편으로는 씁쓸했네요 ㅋㅋㅋ '내가 연락 안해서 서운했냐'고 물어보니 농담하면서 얼버무리길래 살짝 촉이...? 그래서 친하게 지내기만 했지, 여지껏 업무적인 거 이외에 단둘이 뭘 해본 적은 없어서, 다음 날 여태 생각만 했던 저녁 식사 같이 하자고 해봤어요. 회사 위치상 인스타에서 유명한 곳이 많아서.. 내일 퇴근하고 시간 있냐고 물어보니 '밥사주게여?' (원래 말투가 이럼..)라고 하면서 흔쾌히 허락(?)해주더라구요. 근데 출근일이 안 겹쳐서 아직 못 먹긴 했습니다.. 이거 사실 아무 것도 아니기는 한데... 그래도 이런 거에서 호감 여부 캐치할 수 있을까요..? 저는 솔직히 저 카톡 보고 직감이 오긴 했는데, 제 3자 입장에서 보면 다를 수도 있으니... 연애 고수분들 냉철한 답변과 조언 부탁드리겠습니다 ㅠㅠ",1
매일 아메만 마시다가 누가 카페라떼 쿠폰 줘서 괜히 더 싼거 먹으면 손해 같아서 카페라떼 주문했더니 원래 아메 드시지않아요?이러네? 손님 수천명인데 아무 호감 없는데이걸 기억 한다고?그리고 말을 붙인다고?,0
날 좋아하는 남자가있음.. 나보다 최소 3살 이상 연상 (30대 중반) 나는 현재 남친 있음 이분은 내가 남친 있는것도 알고있고 내가직접 남친있다고 말하기도했는데 엄청나게 나한테 호감 표현하고 잘 들어가라고 문자까지함.. 카톡은 안함ㅋㅋ 나 그냥 간보는건가?? 날 좋아하는건 100프로임 제3자한테 듣기도 했고 나도 둔한편인데 너무 잘 느껴질정도로 들이댐.. 순정파인건지 간보는건지 몰겠음..,0
운동하면서 친해진 여동생한테 금욜에 단 둘이 롯데월드 가자고 해서 ok했는데 이정도면 호감 있다고 봐도 될까? 내 주위에서는 7대3비율로 3은 그냥 친하면 갈 수 있다는 마인드네.,0
친구들 모임에서 만나게된 여자가 있는데 마음에 들어서 평일에 따로 밥먹자고 연락해서 밥먹고 카페갔다가 드라이브 다녀왔는데 분위기 좋았거든 ㅎ.. 여자분도 얘기 많이 하시고.. 그래서 다음날 주말에 약속있냐고 물어보니까 둘다 있다고 안된다고 하고 답장도 분 단위가 아니라 시간단위로 텀이있네(본인피셜 카톡 잘 안봄).. 인간적인 호감정도는 있는것같은데 잘 될 확률 별로 없을 것 같지?? 아직 호감표현은 딱히 안하고 친구처럼 대하긴 했는데 그래도 따로 밥먹자고 연락하고 그랬으면 어느정도 얘가 나한테 호감이 있구나 정도는 눈치채지 않았을까..? 좋아하는 티를 더 내볼까 하다가 괜히 부담스러워 할까봐 못하겠어.. 이건 포기하고 다른 여자찾는게 맞는걸까??,0
"어릴때부터 알던 오빠구요, 부모님들끼리도 서로 너무 친하세요. 제가 사실 짝사랑하던 오빠에요. 우연한 기회로 같이 단둘이 밥을 먹게 되었고, 그 이후로 일주일에 한 번씩 토요일마다 만나서 같이 밥먹고 영화도 보러 갔어요. 밥도 잘 사주고 영화티켓도 오빠가 끊어줬어요. 물론 밥은 서로서로 번갈아가면서 사주지만 오빠가 더 잘 사주는 편이에요. 심지어 만나자고 이야기를 이끌어가는 쪽도 오빠에요. 그리고 제가 밤늦게까지 공부하고 가는데 무섭다고 전화를 걸면 항상 잘 받아주고, 전화도 거의 매일 하는 편이에요. 그래서 오빠가 항상 안자고 기다려주는 것 같아요. 카톡도 보내면 칼답이 오구요. 이렇게 지낸지 두달이 넘었습니다. 그런데 오빠가 선톡을 안하고, 항상 연락을 먼저 하는 사람도 저에요. 그리고 만나면 좋긴 한데 고백을 할 것 같은 그런 느낌은 전혀 들지 않아요. 제가 먼저 고백해도 괜찮은 썸관계인지, 진짜 좋은 오빠동생 사이인지 모르겠용.",1
지금 3개월 정도?(1.5개월정도 인사만함) 크로스핏 하면서 친해진 동생 있거든 운동시작전에 자기 어깨를 주물러 달라고도 하고 대화할때 팔 툭툭 치고 옆 단지 아파트 살아서 운동 끝나고 집 나란히 걸어갈때도 내 어깨에 어깨동무식으로 손 올리면서 도착할때까지 그러고 간다... 예전부터 친하게 지낸 여사친도 아니고 급 친해진 경우에도 이렇게 할 수 있나?? 내일 일 끝나고 영화도 보자는데 호감있다고 봐도 될까??,2
모임에서 만난 사람인데 원래 프사 없었는데 내가 찍어준 사진만 프사 검 (프사 지금 있는거 전부 다 내가 찍어준거) 모임 안나가면 왜 안나오시냐고 무슨 일 있냐고 카톡함 모임 코로나로 잠정 휴식 결정됐을 때는 너무 아쉽다고 앞으로도 뵐 수 있냐고 연락함 벙 갔을 때 옷보고 유채꽃 같다고 했는데 프사에 그 옷 올리고 나는 유채꽃 ?? 상메 씀 내가 ㅇㅇㅇ 너무 좋았다고 하니까 다음날 연차쓰고 ㅇㅇㅇ 가보고 너무 좋았다고 연락함 infj 친구인데 원래 사교적이고 표현이 많은 성격인건가? 내가 사진에 소질이 있고 잘 찍나???,2
썸남이 나보고 학창 시절에 공부만 했을거 같이 생겼대.. 칭찬이니까 오해하지 말라고 했는데.. 뭔가 지적인 그런 느낌을 말하고 싶었던걸까? 나쁜 뜻은 아니겠지??,0
"회사에서 친해진 타팀 여자 동료가 있다고 가정해봐 근데 행동이 꽤 호의적이야 (1) 웃으면서 손목, 몸 등을 툭툭 친다 (2) 대화 내내 눈웃음 치고 자주 웃는다 (3) 흘러가듯 종합비타민 먹고싶다하니 생일선물로 사줬다 (4) 업무상으로 찾아올 때 간식도 준다 (5) 같이 1주일에 2번정도 밥 먹는다 (다른사람들 섞여서) 근데 그 여자는 애인이 있어.",1
이거 호감 신호야…? 발주처 사람인데 나보다 나이는 어려보여 나는 28이고 뭐 그래봐야 한두살 차이겠지만 뭔가 만나서 이야기를 하는데 말할때 몸이 닿을 정도로 밀착하는데 보통 그런가...?,0
"내가 정말 도끼병일 수 있어.. 아마 그럴거야.. 아는 사이긴 한데 정말 안친하고 이런저런 이벤트 총 합해서 3번정도 본 사이? 사람도 많아서 정말 사적인 이야기 1도 안했어. 가끔 건물 안에서 지나다닐 때 먼저 인사하시는데.. 아 이게마음에 걸려ㅠㅠ 나 진짜 도끼병인 것 같긴 한데, 우리가 총합해서 3-4번 밖에 안봤는데 나를 어떻게 알지? 싶기도 하고.. 서로 통성명도 안했는데 나를 안다?! 이것도... 정말 어쩌다가 나 마주치면 계속 인사하시는데 그간 나에 대한 관심이 있었나? 싶어져ㅠㅠ 이게 내 도끼병의 시초인가봐.. 정말 사실 나는 상대에게 호감이 있는 상태야. 나는 혹시라도 상대가 눈치챌까봐 아무것도 안하고 있는 상태고... (업무적으로도 마주칠 일 정말 단 하나도 없음) 멀리서라도 나 보고 인사하시는데.. 이거 아예 희망 없는거겠지ㅋㅋㅋ 나 착각 쎄게 하는 거겠지.......ㅠㅠ 오랜만에 술마셔서 그냥 써본다...ㅠㅠ",0
"업무로는 거의 겹치진않고, 서로 얼굴알아서 그냥 보통 직원들 지내듯 가볍게 인사하고 다니는 정도인데 갑자기 남자쪽에서 별이유없이 밥먹자고 하면(점심 1:1) (같이 일도 안해..) 나 아무래도 도끼병인가?.. 근데 짚고보니 여자의 촉인데 아주아주 가끔 굳이 보내지 않아도 되는 메신저가 왔었던것같긴 하거든.. 인싸? 인맥관리하시는 분인가?..그냥 직장생활 한다 생각하고 점심 밥먹고 오면 될까?",1
친구 통해서 알게된 썸남인데 부산에서 살다가 회사땜에 올라왔대 어제 3번째 봤는데 친구포함 4명이서 규카츠 먹으러 갔는데 내가 내꺼 다 먹고 걔꺼 고기 뺏어먹었거든 “디질래?” 이러던데 ㅋㅋㅋ 이거 그린라이트인가? ㅋㅋ 딱3번째 본 사이인데 디질래라닠ㅋㅋㅋㅋㅋ?? 뭔가 박력있고 좋다... 몸도 좋음.. 부산남자들 운동도 열심히 하나봐??,0
나는 내가 호감있으면 절대 그런 제안 안할 것 같은데.. 소개팅 제안하면 그 사람은 날 이성으로 안봐서 그런거야?? 아니면 그냥 떠보는거야?,0
내가 진짜 맘에 든 사람인데ㅜㅜㅜㅜㅜ 그사람도 내가 지나가면 옆으로 고개 돌려서 쳐다보고 눈 자주 마주치고 그러눈데 원래 사람을 잘 쳐다보는 사람일까? 아니면 어느정도 신경이 쓰이니까 쳐다보는걸까?,0
소개녀 나한테 호감 있는걸까 완전 내 이상형의 여성분이랑 소개팅 했는데 만나서 여자분이 별거 아닌걸로 많이 웃기도 하고 대화도 잘 통했고 당일날 새벽 2시까지 실시간으로 카톡 주고 받고 오늘도 이어나가는 중인데 오늘은 한 한시간 텀으로 계속 답장 오는 중 애프터는 신청했는데 담주 약속 다 있다고 월화중에 약속 취소되면 바로 알려주기로 했음 어때보여,0
여자가 남자한테 밥 사달라는 건 호감 표시인가요? 사무실에 기간제 여직원이 있는데 얼마전부터 저한테 먼저 다가와 커피 사달라 밥 사달라고 하더군요 그래서 몇번 사주니 카톡으로 고맙다고 하고 다음에도 같이 먹자고 하네요 이거 그린 라이트 맞은거죠? 띠동갑 연하라서 좀 고민되는데 여자가 적극적으로 나오면 저도 받아들어야 겠어요,0
여자가 호감 있는지 알려면 어떻게 해야돼? 회사 다른부서 사람인데 친구로 만나서 최근에 내가 호감가지게 되어서 얼굴은 자주보고 회사에는 안꾸미는데 주말에 따로보니까 좀 꾸미고 나오네ㅠ,2
소개팅할 때 차로 데려다 준거면 호감 있는걸까? 난 지하철 타고 갔는데 상대방은 차타고 나왔음. 밥먹고 차마시고 갈려는데 집이 같은 방향도 아닌데 집까지 차로 데려다 줬음 이러면 나한테 호감 있는 걸까?,0
"호감 가는 사람이 있는데 그 사람도 나한테 호감이 있는거같아 피곤하다면서 어깨에 기댄다거나, 다른 사람이랑 같이 있을 때도 나한테 더 붙어서 걷는다거나 그런…? 넘 애매한가..ㅠ 더 적극적으로 들이대도 될까..? 나 모솔이라 괜히 더 다가기 겁나는거 있지…",2
"이마트 출장 같이 가자는건 호감표시? 같은 과 여직원이 자기업무땜에 뭐 과자나 살게잇엇나봐 근데 차가 없어서 나보고 내 차타고 같이 이마트 가달래, 근데 솔직히 같이 장보는거는 거의 데이트아님? 이건 나를 어느정도 호감잇어서 그런거지?",0
여자가 남자에게 호감 있어도 자기 체지방 좀 줄이고 보자고 해? 내가 예전에 들이댔던 누나랑 같이 밥 먹고 산책했는데 나는 올해부터 운동해서 체지방 반토막내고 나왔음 근데 누나는 자기말로 지금 역대급 살쪘다고하면서 다음주에 보자고하니깐 자기 채지방 좀 줄이고 다음달에 만나자고 하는데. 이거 신종 거절방법임?,2
저는 남자구요. 연상인 여자동료 A가 있는데 제가 머리자르거나 좀 단정하게 입고오면 그분이 칭찬해주면서 소개팅 안하냐고 항상 묻고 그러곤 햇었습니다. 가끔씩 그분께서 저녁먹자고 연락오기도 했구요. 그러다 동료B 포함해서 셋이서 식사자리 같이했는데 B가 저희보고 솔로니깐 둘이 잘해보라고 짖궃은 농담을 하는데 A분께서 저보고 연상괜찮냐고 장난삼아 물으시더라구요. 부끄러워서 대답은 안했는데 저는 그분께 호감이 있는상태구요. 그분은 어떤마음일까요?,1
여자가 호감 있는지 봐줘 형누나들 난 20대 초중반이고 상대는 연상 직장동료임. 나이 정확히 밝히면 혹시 몰라 이정도만 하고 누나랑 산책하면서 걸을때 먼저 내어깨에 손 올리고 벤치에 앉을때 허벅지터치는 계속하고 가끔 팔짱끼는데 간을 보는건지 꼈다가 조금있다 빼더라고 누나랑 1대1 놀이공원도 갔었고 1대1 밥 카페 영화 드라이브 술집 등 사적으로 6번 이상 만난것 같아. 연락도 자주하고 이정도면 서로 호감 있다고 생각 당연히 하지만 내가 하나 걸리는 건 이 누나가 남사친이 많다는거야. 내 직장이 남초직장이다 보니 당연하다고 생각하는데 다른 남사친이랑도 밥먹고 영화는 봤다고 나한테 솔직하게 얘기한거 봐서는 나도 그냥 남사친부류 인것 같은데 맞지?? 다른 남사친한테는 스킨십 하는지는 모르겠지만 어떤거 같아??,0
방금 미용실 다녀왔는데 타부서 여직원이 머리 하셨네요?이러는데 호감 표현인가요? 방금 머리한건데 보자마자 알길래 신기해서요 저는 남이 머리를 깎던 볶던 관심없고 모르고 말도 안하거든요 신기해서 여쭤봐요,0
"전 남자구요. 간단한 소개를 한다면요. 182에 깔끔하고 스마트하게 생겼습니다. 직장 내에서 유능하다 인정받고 있습니다. 같은 직장에 근무하는 여성분이 있어요. 그분의 마음이 궁금해서요. 조심스럽게 글을 올립니다. 그분은.. 리액션도 좋고, 잘 웃기도 하구요. 도움을 요청하면 잘 도와줍니다. 또, 제가 모임을 주선하면 잘 나오기도 하구요. 주차장에 먼저 도착하더라도 올라가는 타이밍 맞추려는 느낌도 드는데.. 또 저에게 하는 표현이 눈 엄청 높을거 같다. 능력있다. 다 잘하신다 옷 잘 입는다. 인데.. 동료로서 호감 표현인지 아님.. 긍정적 시그널인지 헷갈리네요.",1
스타벅스 갔는데 이정도면 호감 표시? 다 다른날임 머리 하셨네요? 오늘은 아이스 안드세요? 오늘은 샷추가 안하세요? 자주 안오셨네요? 긴가민가해서 써봄,0
1. 만날 때마다 사소한 선물 주려고 함 2. 항상 사람들 많은 곳에서 챙겨줌 3. 뭐하고 있으면 사진 찍어서 보정해서 보내줌 4. 동영상 찍어주면서 귀엽다고 함 5. 같이 차 타고 가다가 졸면 자라고 작은 베개 꺼내 줌 6. 조는데 머리 쓰담쓰담 해줌 7. 내가 좋아하는 음식 위주로 매번 먹이려고 함 8. 항상 옷 잘 어울린다고 칭찬해줌 9. 항상 집이 40분 거린데 와서 기다려주고 데려다줌 10. 다른 사람들이 같은 방향으로 가서 그 차 타고 가면 되는데 자기 차로 데려다줌 11. 한 번 보면 새벽 1-2시까지 6시간 넘게 얘기해도 재밌어함. 새벽 3시까지 서로 차 안에서 얘기한 적 있음. 12. 같이 밥 먹고 2-3시간 걸으면서 얘기함 13. 내가 부정적으로 얘기하면 아니라고 칭찬해줌 14. 옛날에 나 찍은 사진들 보내줌 15. 옛날에 둘이 처음 알게된 당시에 찍힌 사진들 보여줌 16. 밥 잘 챙겨먹으라고 밥 뭐 먹었냐고 매번 물어봄 17. 인스타에서 귀여운 동물들 릴즈 보면 꼭 공유해줌 18. 너 오래 못 보면 그리울거라고 함 안지 5년된 친군데 원래 배려심 많고 착한 친구긴 해 그냥 내가 의미부여하는걸까,2
일단 난 길게 연애하다 최근에 헤어짐 일에 집중할 수 있는 기분이 아니어서 마침 휴가도 남았겠다 지난달에 1주일 내내 휴가쓰고 바람쐬고옴 근데 동료 여직원이 휴가때 먹으라고 뜬금없이 과일바구니를 보내줌 샤인머스캣이 아주 탐스럽게 영글었는데 이거 호감 먹고 자란거지?,1
내가 연애고자라 물어볼게 짝남이 주말에 본인 뭐했는지 사진찍어보내주고 나 생일이라고 선물 보내주는데 이거 호감? 근데 왜 만나자고는 안하지..,1
"이 여자 나한테 호감 있는걸까??? 첨엔 단순히 정규직(나), 계약직(그녀)로 만나게 됐다 맨처음에는 서로 둘다 여친, 남친 있는 사이였음 다른 지점 근무하는 친구라 실물로 본건 1번인데 첨엔 업무적으로 메신저만 하다가 심심해서 이런저런 챗 하면서 취준하는 친구라는걸 알게됐고 예전에 나 취준하던 시절 챙겨주는 사람이 없어 맨땅에 헤딩했던게 생각나서 측은지심에 갠톡으로도 이것저것 많이 알려줬어 그러다가 최근들어 부쩍 연락을 자주하게 됐고 그 친구가 나보고, 자기있는 지점으로 출장나오면 그동안 취준정보 이것저것 많이 챙겨주니까 맛있는거 사준다고도 했어. 서로 헤어진시기도 비슷하다는거 알게됐구 먹는 취향이나 취미같은것도 비슷한게 많아서 그때부터 호감이 생기더라 주말에도, 솔직히 직장상사라도 생각하면 귀찮을법도 한데 답장도 꼬박꼬박해주고 나에대한 질문도 많이 해줘서 주말내내 김칫국 많이 마시고, 내가준 기프티콘으로 커피사먹은 인증샷 남기면서 선톡도 주더랑 오늘 아침에는 그냥 까일수도 있겠지만 그래도 혹여나 하는 마음에, 주말에 서점에 책구경 갈껀데 시간되면 얼굴보고 밥이나 먹을래요? 라고 하니까 의외로 거절없이 흔쾌히 승낙하더라구. 토요일날 만나면 밥먹구 서점갔다가 카페나 보드게임 카페 이런데 갈 생각인데 이정도면 부담스러워 하진 않겠지? 좀더 다가가봐도 괜찮겠지???",2
"0. 알게 된지는 1년 조금 넘었고 개인적으로 연락한지는 3달 됨 0-1어제 포함 지금까지 3번봄 단둘이 만난건 두번 두번 다 걔가 먼저 보자해서 봄 (한번은 그냥 저녁만, 이번엔 영화) 1. 평소에 연락 거의 안함 선톡은 거의 걔가 먼저 하는데 거기서 내가 대화를 이어가려고 하면 반응이 별로 없음 그대로 뚝 끊김 읽씹도 자주함 2. 그러고 발렌타인데이때 아무 연락도 없어서 걍 접었음 3. 그런데 월요일에 갑자기 슬램덩크 봤냐고 물어보길래 안봤다고 했더니 보러가자고 함 4. 그래서 어제 만났음. 영화 시작까지 시간좀 남아서 그냥 걷다가 걔가 인생네컷 찍고싶다 해서 찍음. 5. 그리고 영화 보는데 중반부부터 좀 춥다고 패딩 덮고 있었음, 중간중간 나 쳐다보면서 춥다고 하길래 코트 벗어줄까 생각했는데 롱코트 벗기도 힘들고 상황이 너무 애매해서 일단 넘김 6. 영화 보면서 점점 몸이 가까워지다가 내 어께에 기댐. 너무 급하게 과한 액션 취하긴 좀 그래서 고개만 같이 기울여서 붙어 있었음 (이때 끌어 안았어야 되나?) 7. 영화 끝나고 뭐 재밌었다 얘기하고 저녁 먹으러 감 티켓/ 밥은 내가 사고 팝콘은 걔가 샀음 8. 그리고 서로 인생고민이랑 사는거 대화 하다가 역 도착해서 각자 집감.(둘다 뚜벅이) 데려다 주지는 않았음. 이게 대략적인 정보고 사실 아래가 더 중요한 부분임 [초 중요 포인트] 그 애가 전남친 문제로 자꾸 나한테 말검. 8번에서도 그 얘기 했음 굳이 단 둘이 만나서까지. 전남친이랑 연락을 할까 말까 걔한테 연락 하고싶다 막 그런식인데 헤어지고도 애매한 친구사이로 지내는거 같더라고. 같이 게임 하다가 맨날 또 싸우고 서로 연락 며칠씩 씹다가 다시 먼저 연락 걸고 뭐 맨날 그런식이라는데 먼저 사과를 하니 마니 되게 찌질하게 만나는데 본인도 그걸 알고있는데 끝낼수가 없다고 함 (그걸 왜 나한테...? 나는 또 왜 병신같이 그걸 다 들어주고 있지) 어제 집가서 걔한테 연락 했냐고 물어보니까 화나서 안했대. 뭔가 질투 유발해서 내가 연락하지 말라고 강하게 밀고 가는걸 원하는거 같기도 하고 그런데 그렇다고 걔가 나한테 막 잘 해주는거도 아니라 애매함. 연락이라도 잘 되고 내가 걔가 괜찮은 애로 느껴졌으면 나도 좀 용기를 내볼텐데 맨날 신경쓰이게만 하고 마음에는 안드는 행동이 많음 솔직히 진짜 심리전이라고 해도 이런식으로 심리전 거는것도 딱히 마음에 안드는데 그렇다고 손절하기에도 애매하고 잘 모르겠음",0
"잇팁 남자 너네 호감 표현 어케함? 그냥 퇴근하고 보자해서 카페서 2,3시간 얘기하고 한강 가고 싶다했더니 흔쾌히 같이 가서 산책은 했는데.. 그 후에 연락은 잘 해주지는 않는데.. 잇팁 남자들이 보여주는 호감 시그널 모얌?",2
"그녀의 호의와 호감 구분 방법은? 연락하고 지내는 분이 계신데, 나에 대한 호의인지 나에 대한 호감인지 구분이 안가네요. 거의 매일 연락(까똑)과 1,2주에 한두번의 약속? 내가 똥멍청이라그런가.. 후 방법이 있을까요.",1
"ISTP 남자 너네 호감 표현 어케함? 그냥 퇴근하고 보자해서 카페서 2,3시간 얘기하고 한강 가고 싶다했더니 흔쾌히 같이 가서 산책은 했는데.. 그 후에 연락은 잘 해주지는 않는데.. ISTP 남자들이 보여주는 호감 시그널 모얌?",2
이성 친구랑 계절학기 같이하는데 맨날 같이 피시방가서 게임하거든? 원래 맨날 다른 라인 갔는데 오늘은 갑자기 같은 라인 하고싶다네? 또 갑자기 집에 데려달라고 하네? 이건 그린롸잇트 인가?,1
"나 동아리에 좋아하는 여자가 있는데, 어렵게 경복궁 야간개장 끊어서 어렵게 같이 가자고 했는데, 둘이서 같이 갔거든? 사진도 찍고, 맛있는거 먹고 했어. 그리고 학교에서는 산책도 자주 갔거든? 근데 왜 아무 반응이 없지? 그냥 간건가?",1
"내가 꽃을 좋아하는데, 같이 일하는 직장동료가 경사나 생일같은 이벤트마다 선물로 꽃다발을 주는데 이거 그린라이트인거야?",0
"대학 동기인데 3년동안 데면데면하게 지내다가 4학년 때 같은 수업으로 만나서 옆자리 앉길래 말 텄음. 어느 날 갑자기 영화를 보러 가자고 카톡을 하대? 무슨 영화가 보고 싶냐고 하니까 그냥 영화관 팝콘이 먹고 싶다고 같이 가줄거냐고 하더라고ㅋㅋㅋ 마침 보고 싶던 호러 영화가 나와서 밤에 같이 영화 보고, 끝나고 나와서 걔 버스 타는거 기다려주고 난 집에 돌아옴. 그 이후로 겁나 친해져서 같이 밥도 먹고 과제도 하고 학교 축제도 돌아다니고 했는데, 문득 드는 생각이 이 친구가 나한테 관심이 있어서 나랑 같이 다녀주는건가?",2
직장동료들이랑 지나가면서 좋아하는거 얘기한적이 있거든? 그때 곰인형 얘기를 했었는데 나중에 생일선물로 받았어! 이거 그린라이트야?,0
"나 자취하거든 근데 어제 친구들이랑 늦게까지 술먹었단 말이야. 그런데 이성친구 기숙사 통금시간 걸려서 못들어갔어. 이성친구가 우리집에서 자고가도 되냐고 해서 자고 가라고 했는데, 진짜오고 있어? 나 어떻게 빨리 답변좀.",0
고등학교 때 아침마다 편의점이나 빵집에서 본인 먹을 간식 사오는 친구가 있었어요. 그 친구랑 짝궁이었는데 매일 본인 간식을 반씩 나눠서 제게 먹으라고 주더라구요! 그리고 제가 비타민 같은거 먹는게 있었는데 매일 비타민 먹었냐고 체크도 해주고ㅎㅎ 이건 그린라이트인가요?!,0
항상 이름을 두번씩 부르면서 장난치다가 갑자기 저를 한번만 부르면서 데이트 신청을 하는데 이거 그린라이트인가요,0
